{"$defs":{"__schema0":{"anyOf":[{"type":"string"},{"type":"number"},{"type":"boolean"},{"type":"null"},{"items":{"$ref":"#/$defs/__schema0"},"type":"array"},{"additionalProperties":{"$ref":"#/$defs/__schema0"},"propertyNames":{"type":"string"},"type":"object"}]}},"$schema":"https://json-schema.org/draft/2020-12/schema","additionalProperties":false,"properties":{"attestations":{"items":{"additionalProperties":false,"properties":{"algorithm":{"minLength":1,"type":"string"},"keyId":{"minLength":1,"type":"string"},"signature":{"minLength":1,"type":"string"}},"required":["algorithm","keyId","signature"],"type":"object"},"type":"array"},"digest":{"additionalProperties":false,"properties":{"algorithm":{"minLength":1,"type":"string"},"value":{"minLength":1,"type":"string"}},"required":["algorithm","value"],"type":"object"},"extensions":{"additionalProperties":{"$ref":"#/$defs/__schema0"},"propertyNames":{"pattern":"^[A-Za-z][A-Za-z0-9+.-]*:","type":"string"},"type":"object"},"id":{"minLength":1,"type":"string"},"issuedAt":{"format":"date-time","pattern":"^(?:(?:\\d\\d[2468][048]|\\d\\d[13579][26]|\\d\\d0[48]|[02468][048]00|[13579][26]00)-02-29|\\d{4}-(?:(?:0[13578]|1[02])-(?:0[1-9]|[12]\\d|3[01])|(?:0[469]|11)-(?:0[1-9]|[12]\\d|30)|(?:02)-(?:0[1-9]|1\\d|2[0-8])))T(?:(?:[01]\\d|2[0-3]):[0-5]\\d(?::[0-5]\\d(?:\\.\\d+)?)?(?:Z|([+-](?:[01]\\d|2[0-3]):[0-5]\\d)))$","type":"string"},"issuer":{"minLength":1,"type":"string"},"kind":{"const":"ConnectionPolicy","type":"string"},"payload":{"additionalProperties":false,"properties":{"rules":{"items":{"additionalProperties":false,"properties":{"actions":{"items":{"minLength":1,"type":"string"},"minItems":1,"type":"array"},"audiences":{"items":{"minLength":1,"type":"string"},"minItems":1,"type":"array"},"claimMediaTypes":{"items":{"minLength":1,"type":"string"},"minItems":1,"type":"array"},"contexts":{"items":{"minLength":1,"type":"string"},"minItems":1,"type":"array"},"domains":{"items":{"minLength":1,"type":"string"},"minItems":1,"type":"array"},"effect":{"enum":["allow","deny"],"type":"string"},"id":{"minLength":1,"type":"string"},"profiles":{"items":{"minLength":1,"type":"string"},"minItems":1,"type":"array"},"publishers":{"items":{"minLength":1,"type":"string"},"minItems":1,"type":"array"},"purposes":{"items":{"minLength":1,"type":"string"},"minItems":1,"type":"array"},"requiredAttestations":{"items":{"minLength":1,"type":"string"},"type":"array"},"requiredEvidence":{"items":{"minLength":1,"type":"string"},"type":"array"},"validFrom":{"format":"date-time","pattern":"^(?:(?:\\d\\d[2468][048]|\\d\\d[13579][26]|\\d\\d0[48]|[02468][048]00|[13579][26]00)-02-29|\\d{4}-(?:(?:0[13578]|1[02])-(?:0[1-9]|[12]\\d|3[01])|(?:0[469]|11)-(?:0[1-9]|[12]\\d|30)|(?:02)-(?:0[1-9]|1\\d|2[0-8])))T(?:(?:[01]\\d|2[0-3]):[0-5]\\d(?::[0-5]\\d(?:\\.\\d+)?)?(?:Z|([+-](?:[01]\\d|2[0-3]):[0-5]\\d)))$","type":"string"},"validUntil":{"format":"date-time","pattern":"^(?:(?:\\d\\d[2468][048]|\\d\\d[13579][26]|\\d\\d0[48]|[02468][048]00|[13579][26]00)-02-29|\\d{4}-(?:(?:0[13578]|1[02])-(?:0[1-9]|[12]\\d|3[01])|(?:0[469]|11)-(?:0[1-9]|[12]\\d|30)|(?:02)-(?:0[1-9]|1\\d|2[0-8])))T(?:(?:[01]\\d|2[0-3]):[0-5]\\d(?::[0-5]\\d(?:\\.\\d+)?)?(?:Z|([+-](?:[01]\\d|2[0-3]):[0-5]\\d)))$","type":"string"}},"required":["id","effect","publishers","profiles","domains","actions","contexts","claimMediaTypes","purposes","audiences","validFrom","validUntil","requiredEvidence","requiredAttestations"],"type":"object"},"type":"array"}},"required":["rules"],"type":"object"},"payloadMediaType":{"minLength":1,"type":"string"},"protocolVersion":{"const":"0.1","type":"string"}},"required":["protocolVersion","id","issuedAt","issuer","payloadMediaType","kind","payload","digest"],"type":"object"}
