{"digest":{"algorithm":"sha-256","value":"f7b72e7f5b29c601d97b11b77a8cd841d5493b50576e76f1a098f8ad46944ffb"},"id":"urn:policy:local-city","issuedAt":"2026-09-01T00:00:00Z","issuer":"urn:lighthouse:engram","kind":"ConnectionPolicy","payload":{"rules":[{"actions":["recall","read","inject_context"],"audiences":["self"],"claimMediaTypes":["application/vnd.engram.recall-rank-claim+json"],"contexts":["memory/technical"],"domains":["memory.recall"],"effect":"allow","id":"allow-why-technical","profiles":["urn:lighthouse:profile:engram-recall-trace"],"publishers":["urn:lighthouse:why"],"purposes":["session-recall"],"requiredAttestations":[],"requiredEvidence":[],"validFrom":"2026-09-01T00:00:00Z","validUntil":"2026-10-01T00:00:00Z"},{"actions":["recall"],"audiences":["self"],"claimMediaTypes":["application/vnd.engram.recall-rank-claim+json"],"contexts":["memory/technical"],"domains":["memory.recall"],"effect":"allow","id":"allow-blocks-recall","profiles":["urn:lighthouse:profile:engram-recall-trace"],"publishers":["urn:lighthouse:blocks"],"purposes":["session-recall"],"requiredAttestations":[],"requiredEvidence":[],"validFrom":"2026-09-01T00:00:00Z","validUntil":"2026-10-01T00:00:00Z"},{"actions":["inject_context"],"audiences":["self"],"claimMediaTypes":["application/vnd.engram.recall-rank-claim+json"],"contexts":["memory/technical"],"domains":["memory.recall"],"effect":"deny","id":"deny-blocks-inject","profiles":["urn:lighthouse:profile:engram-recall-trace"],"publishers":["urn:lighthouse:blocks"],"purposes":["session-recall"],"requiredAttestations":[],"requiredEvidence":[],"validFrom":"2026-09-01T00:00:00Z","validUntil":"2026-10-01T00:00:00Z"},{"actions":["recall"],"audiences":["self"],"claimMediaTypes":["application/vnd.engram.recall-rank-claim+json"],"contexts":["memory/*"],"domains":["memory.recall"],"effect":"deny","id":"deny-gil-memory-prefix","profiles":["urn:lighthouse:profile:engram-recall-trace"],"publishers":["urn:lighthouse:gil"],"purposes":["session-recall"],"requiredAttestations":[],"requiredEvidence":[],"validFrom":"2026-09-01T00:00:00Z","validUntil":"2026-10-01T00:00:00Z"},{"actions":["recall"],"audiences":["self"],"claimMediaTypes":["application/vnd.engram.recall-rank-claim+json"],"contexts":["memory/technical"],"domains":["memory.recall"],"effect":"allow","id":"allow-gil-technical-exact","profiles":["urn:lighthouse:profile:engram-recall-trace"],"publishers":["urn:lighthouse:gil"],"purposes":["session-recall"],"requiredAttestations":[],"requiredEvidence":[],"validFrom":"2026-09-01T00:00:00Z","validUntil":"2026-10-01T00:00:00Z"},{"actions":["recall"],"audiences":["self"],"claimMediaTypes":["application/vnd.engram.recall-rank-claim+json"],"contexts":["memory/technical"],"domains":["memory.recall"],"effect":"allow","id":"allow-agi-technical","profiles":["urn:lighthouse:profile:engram-recall-trace"],"publishers":["urn:lighthouse:agi"],"purposes":["session-recall"],"requiredAttestations":[],"requiredEvidence":[],"validFrom":"2026-09-01T00:00:00Z","validUntil":"2026-10-01T00:00:00Z"},{"actions":["recall"],"audiences":["self"],"claimMediaTypes":["application/vnd.engram.recall-rank-claim+json"],"contexts":["memory/technical"],"domains":["memory.recall"],"effect":"deny","id":"deny-agi-technical","profiles":["urn:lighthouse:profile:engram-recall-trace"],"publishers":["urn:lighthouse:agi"],"purposes":["session-recall"],"requiredAttestations":[],"requiredEvidence":[],"validFrom":"2026-09-01T00:00:00Z","validUntil":"2026-10-01T00:00:00Z"}]},"payloadMediaType":"application/vnd.lighthouse.connection-policy+json","protocolVersion":"0.1"}
